{
  "session": {
    "id": "2026-01-09_115902_project-plan",
    "title": "스마트 물류관리 시스템 구축 프로젝트 수행계획서",
    "status": "in_progress",
    "created_at": "2026-01-09T11:59:02"
  },
  "current_stage": 2,
  "setup": {
    "presentation": {
      "title": "스마트 물류관리 시스템 구축 프로젝트 수행계획서",
      "subtitle": "(주)테크솔루션",
      "audience": "발주기관 경영진 및 프로젝트 관계자",
      "purpose": "프로젝트 수행계획 공유 및 승인",
      "source_file": "project-plan.md"
    },
    "theme": {
      "id": "dongkuk-systems",
      "name": "동국시스템즈",
      "colors": {
        "primary": "#002452",
        "secondary": "#C51F2A",
        "accent1": "#757575",
        "accent2": "#4B6580",
        "accent3": "#B7D0D4",
        "accent5": "#D55633",
        "accent6": "#E9B86E",
        "dark_text": "#262626",
        "light_bg": "#FFFFFF",
        "gray": "#B6B6B6"
      },
      "fonts": {
        "title": "본고딕 Medium",
        "body": "본고딕 Normal"
      }
    },
    "document_template": {
      "group": "dongkuk-systems",
      "template": "기본양식",
      "source": "동국시스템즈 기본양식.pptx"
    }
  },
  "slides": [
    {
      "index": 0,
      "title": "스마트 물류관리 시스템 구축 수행계획서",
      "purpose": "cover",
      "layout_category": "cover",
      "key_points": ["(주)테크솔루션", "2025-01-03"]
    },
    {
      "index": 1,
      "title": "목차",
      "purpose": "toc",
      "layout_category": "section",
      "key_points": ["프로젝트 개요", "추진 전략 및 방법론", "프로젝트 조직", "프로젝트 일정", "관리 계획"]
    },
    {
      "index": 2,
      "title": "01 프로젝트 개요",
      "purpose": "section",
      "layout_category": "section",
      "key_points": ["프로젝트 정보", "배경 및 목적", "시스템 범위"]
    },
    {
      "index": 3,
      "title": "프로젝트 기본 정보",
      "purpose": "stats",
      "layout_category": "content_visual",
      "key_points": [
        "발주기관: (주)글로벌물류",
        "수행사: (주)테크솔루션",
        "계약금액: 15억원",
        "계약기간: 12개월 (2025.01~12)"
      ]
    },
    {
      "index": 4,
      "title": "프로젝트 배경 및 목적",
      "purpose": "comparison",
      "layout_category": "content_visual",
      "key_points": [
        "현황: 10년 이상 레거시 시스템, 처리 속도 저하, 실시간 재고 파악 불가",
        "목표: AI 기반 물류 최적화, 실시간 재고/배송 추적, 클라우드 기반 확장성"
      ]
    },
    {
      "index": 5,
      "title": "기대 효과",
      "purpose": "stats",
      "layout_category": "content_visual",
      "key_points": [
        "물류 처리 효율 30% 향상",
        "재고 정확도 99.5% 달성",
        "운영 비용 20% 절감"
      ]
    },
    {
      "index": 6,
      "title": "시스템 범위",
      "purpose": "grid",
      "layout_category": "content_visual",
      "key_points": [
        "WMS: 창고관리 - 입출고, 재고, 피킹/패킹",
        "TMS: 배송관리 - 배차, 경로최적화, 추적",
        "OMS: 주문관리 - 주문접수, 할당, 정산",
        "Dashboard: 통합모니터링 - 실시간 현황, KPI"
      ]
    },
    {
      "index": 7,
      "title": "02 추진 전략 및 방법론",
      "purpose": "section",
      "layout_category": "section",
      "key_points": ["핵심 전략", "수행 방법론", "기술 아키텍처"]
    },
    {
      "index": 8,
      "title": "핵심 추진 전략",
      "purpose": "grid",
      "layout_category": "content_visual",
      "key_points": [
        "단계적 전환: Big Bang 아닌 모듈별 순차 전환으로 리스크 최소화",
        "애자일 기반: 2주 단위 스프린트로 빠른 피드백과 유연한 대응",
        "현업 밀착: 주 2회 현업 리뷰를 통한 요구사항 정합성 확보"
      ]
    },
    {
      "index": 9,
      "title": "수행 방법론",
      "purpose": "process",
      "layout_category": "content_visual",
      "key_points": [
        "방법론: Agile-Waterfall 하이브리드",
        "분석: 요구사항 정의, 현행 분석",
        "설계: 아키텍처/UI/DB 설계",
        "개발: 기능 구현, 단위 테스트",
        "테스트/이행: 통합/인수 테스트, 시스템 전환"
      ]
    },
    {
      "index": 10,
      "title": "기술 아키텍처",
      "purpose": "process",
      "layout_category": "content_visual",
      "key_points": [
        "Frontend: Vue.js 3, TypeScript (SPA 구조)",
        "Backend: Spring Boot 3.2, Java 17 (MSA 구조)",
        "Database: PostgreSQL 16, Redis 7 (RDBMS + Cache)",
        "Infra: AWS (EKS, RDS, S3) - 클라우드 네이티브",
        "AI/ML: Python 3.11, TensorFlow 2.15 - 수요예측, 경로최적화"
      ]
    },
    {
      "index": 11,
      "title": "03 프로젝트 조직",
      "purpose": "section",
      "layout_category": "section",
      "key_points": ["조직 구성", "역할 및 책임", "투입 인력"]
    },
    {
      "index": 12,
      "title": "프로젝트 조직도",
      "purpose": "hierarchy",
      "layout_category": "content_visual",
      "key_points": [
        "발주기관 PM: 정민호 부장 - 총괄 관리, 의사결정",
        "수행사 PM: 김철수 차장 - 수행 총괄, 품질/위험 관리",
        "PMO: 이영희 과장 - 프로젝트 관리 지원",
        "AA: 박준형 책임 - 시스템 설계, 아키텍처"
      ]
    },
    {
      "index": 13,
      "title": "투입 인력 현황",
      "purpose": "table",
      "layout_category": "content_visual",
      "key_points": [
        "PM 김철수(특급) 12개월",
        "AA 박준형(특급) 10개월",
        "PL 최수진(고급) 12개월",
        "개발 3명(고급/중급) 10개월",
        "DBA 오현우(고급) 8개월",
        "QA 한미영(중급) 6개월",
        "총 8명, 78MM"
      ]
    },
    {
      "index": 14,
      "title": "04 프로젝트 일정",
      "purpose": "section",
      "layout_category": "section",
      "key_points": ["마스터 일정", "주요 마일스톤"]
    },
    {
      "index": 15,
      "title": "마스터 일정",
      "purpose": "timeline",
      "layout_category": "content_visual",
      "key_points": [
        "착수 (1월 4주): 킥오프, 환경구축, 표준정의",
        "분석 (2~3월 8주): 요구사항 확정, 현행 분석",
        "설계 (4~5월 8주): 아키텍처/화면/DB 설계",
        "개발 (6~9월 16주): 코딩, 단위테스트",
        "테스트 (10~11월 6주): 통합/성능/인수 테스트",
        "이행 (11~12월 6주): 오픈, 운영이관, 안정화"
      ]
    },
    {
      "index": 16,
      "title": "주요 마일스톤",
      "purpose": "timeline",
      "layout_category": "content_visual",
      "key_points": [
        "M1 착수보고 (1/10): 수행계획서",
        "M2 요구사항 확정 (3/31): 요구사항정의서",
        "M3 설계 완료 (5/31): 설계서 일체",
        "M4 개발 완료 (9/30): 소스코드",
        "M5 테스트 완료 (11/15): 테스트결과서",
        "M6 시스템 오픈 (12/1): 오픈보고서"
      ]
    },
    {
      "index": 17,
      "title": "05 관리 계획",
      "purpose": "section",
      "layout_category": "section",
      "key_points": ["품질 관리", "보안 관리", "위험 관리"]
    },
    {
      "index": 18,
      "title": "품질 관리 계획",
      "purpose": "grid",
      "layout_category": "content_visual",
      "key_points": [
        "산출물 검토: 단계별 말 발주 담당자 검토 및 승인",
        "코드 리뷰: GitHub PR 필수, 2인 이상 승인",
        "정적 분석: SonarQube 품질 게이트 적용",
        "테스트: 시나리오 기반 통합/인수 테스트"
      ]
    },
    {
      "index": 19,
      "title": "보안 관리 계획",
      "purpose": "grid",
      "layout_category": "content_visual",
      "key_points": [
        "인적 보안: 보안서약서 징구, 보안 교육 실시",
        "물리 보안: 통제구역 출입 관리, 반입 장비 통제",
        "기술 보안: 소스코드 보안약점 진단, DB 암호화",
        "PC 보안: 백신, 화면보호기, DLP 솔루션 적용"
      ]
    },
    {
      "index": 20,
      "title": "위험 관리 계획",
      "purpose": "table",
      "layout_category": "content_visual",
      "key_points": [
        "요구사항 변경(상/상): CCB 통제, 영향도 분석 필수",
        "일정 지연(상/중): 주간 진척관리, Critical Path 모니터링",
        "기술적 난제(중/중): PoC 선행, 외부 전문가 자문",
        "인력 이탈(상/하): 대체 인력 풀 확보, 기술 문서화",
        "데이터 마이그레이션(상/중): 사전 검증, 롤백 계획"
      ]
    },
    {
      "index": 21,
      "title": "감사합니다",
      "purpose": "closing",
      "layout_category": "cover",
      "key_points": ["(주)테크솔루션", "PM 김철수 차장"]
    }
  ]
}
