{
  "session": {
    "id": "2026-01-09_project-plan-v3",
    "title": "스마트 물류관리 시스템 구축 프로젝트 수행계획서",
    "created_at": "2026-01-09T16:00:00+09:00",
    "status": "in_progress"
  },
  "current_stage": 2,
  "setup": {
    "presentation": {
      "title": "스마트 물류관리 시스템 구축 프로젝트",
      "subtitle": "수행계획서",
      "audience": "혼합 (경영진+실무자)",
      "duration": "20-30분",
      "emphasis": "전체 균형",
      "slide_count": "18장",
      "client": "(주)글로벌물류",
      "vendor": "(주)테크솔루션",
      "date": "2025-01-03"
    },
    "theme": {
      "id": "deepgreen",
      "name": "Deep Green",
      "colors": {
        "primary": "#1E5128",
        "secondary": "#4E9F3D",
        "accent": "#D8E9A8",
        "background": "#FFFFFF",
        "surface": "#F4F6F6",
        "dark_text": "#191A19",
        "light": "#FFFFFF",
        "gray": "#AAB7B8"
      }
    }
  },
  "slides": [
    {
      "index": 0,
      "title": "스마트 물류관리 시스템 구축",
      "purpose": "cover",
      "key_points": ["수행계획서", "(주)테크솔루션", "2025.01"],
      "speaker_notes": "프로젝트 착수보고를 위한 수행계획서입니다."
    },
    {
      "index": 1,
      "title": "목차",
      "purpose": "toc",
      "key_points": [
        "1. 프로젝트 개요",
        "2. 추진 전략 및 방법론",
        "3. 프로젝트 조직 및 일정",
        "4. 품질 및 위험 관리"
      ],
      "speaker_notes": "4개 섹션으로 구성된 수행계획서 목차입니다."
    },
    {
      "index": 2,
      "title": "프로젝트 개요",
      "purpose": "section",
      "key_points": ["01"],
      "speaker_notes": "프로젝트의 기본 정보와 배경, 목표를 설명합니다."
    },
    {
      "index": 3,
      "title": "프로젝트 정보 및 배경",
      "purpose": "content",
      "key_points": [
        "프로젝트명: 스마트 물류관리 시스템 구축",
        "발주기관: (주)글로벌물류 / 수행사: (주)테크솔루션",
        "계약금액: 15억원 (VAT 별도)",
        "계약기간: 2025-01-06 ~ 2025-12-31 (12개월)",
        "배경: 연간 500만건 물류 처리, 레거시 시스템 노후화",
        "문제점: 처리 속도 저하, 실시간 재고 파악 불가, 시스템 연동 한계"
      ],
      "speaker_notes": "글로벌물류는 국내 Top 5 물류기업으로 차세대 시스템 구축이 필요합니다."
    },
    {
      "index": 4,
      "title": "추진 목표 및 기대효과",
      "purpose": "stats",
      "key_points": [
        "물류 처리 효율 30% 향상",
        "재고 정확도 99.5% 달성",
        "운영 비용 20% 절감",
        "3년 내 ROI 79% 달성 기대"
      ],
      "speaker_notes": "AI 기반 물류 최적화, 실시간 추적, 클라우드 확장성 확보. 오토스토어 연구에 따르면 물류 자동화 시스템 도입 시 창고 면적 75% 감소, 피킹 인력 50% 절감, 피킹 오류 99% 감소 효과가 있습니다.",
      "source": "오토스토어 TEI 연구 보고서 (2024)"
    },
    {
      "index": 5,
      "title": "시스템 범위",
      "purpose": "grid",
      "key_points": [
        "WMS (창고관리): 입출고, 재고, 피킹/패킹",
        "TMS (배송관리): 배차, 경로최적화, 추적",
        "OMS (주문관리): 주문접수, 할당, 정산",
        "Dashboard (통합모니터링): 실시간 현황, KPI, 리포트"
      ],
      "speaker_notes": "4개 핵심 모듈을 개발하며, 회계/HR/ERP는 인터페이스만 개발합니다."
    },
    {
      "index": 6,
      "title": "추진 전략 및 방법론",
      "purpose": "section",
      "key_points": ["02"],
      "speaker_notes": "프로젝트의 핵심 전략과 수행 방법론을 설명합니다."
    },
    {
      "index": 7,
      "title": "핵심 추진 전략",
      "purpose": "feature",
      "key_points": [
        "단계적 전환 전략: Big Bang 방식이 아닌 모듈별 순차 전환으로 리스크 최소화",
        "애자일 기반 개발: 2주 단위 스프린트로 빠른 피드백과 유연한 대응",
        "현업 밀착 협업: 주 2회 현업 리뷰를 통한 요구사항 정합성 확보",
        "방법론: Agile-Waterfall 하이브리드 (대규모 SI 안정성 + 애자일 유연성)"
      ],
      "speaker_notes": "안정적 전환과 혁신적 기능 구현의 균형을 핵심 가치로 추진합니다."
    },
    {
      "index": 8,
      "title": "기술 아키텍처",
      "purpose": "diagram",
      "key_points": [
        "Frontend: Vue.js 3, TypeScript (SPA 구조)",
        "Backend: Spring Boot 3.2, Java 17 (MSA 구조)",
        "Database: PostgreSQL 16, Redis 7 (RDBMS + Cache)",
        "Infra: AWS (EKS, RDS, S3) - 클라우드 네이티브",
        "AI/ML: Python 3.11, TensorFlow 2.15 (수요예측, 경로최적화)"
      ],
      "speaker_notes": "단순 반복 작업을 대체하는 로봇, AI 의사결정 지원, WMS 통합 관리가 필수 요소입니다."
    },
    {
      "index": 9,
      "title": "프로젝트 조직 및 일정",
      "purpose": "section",
      "key_points": ["03"],
      "speaker_notes": "프로젝트 조직 구성과 일정 계획을 설명합니다."
    },
    {
      "index": 10,
      "title": "프로젝트 조직 구성",
      "purpose": "hierarchy",
      "key_points": [
        "발주기관 PM: 정민호 부장 (최종 승인권자)",
        "수행사 PM: 김철수 차장 (프로젝트 수행 총괄)",
        "PMO: 이영희 과장 (품질 검토)",
        "AA: 박준형 책임 (MSA 전문가)",
        "개발 리더: 최수진 선임 (풀스택)",
        "QA: 한미영 대리 (ISTQB), DBA: 오현우 대리 (OCP)"
      ],
      "speaker_notes": "발주기관과 수행사의 명확한 R&R로 프로젝트를 관리합니다."
    },
    {
      "index": 11,
      "title": "투입 인력 현황",
      "purpose": "table",
      "key_points": [
        "PM 김철수 (특급) 12개월",
        "AA 박준형 (특급) 10개월",
        "PL 최수진 (고급) 12개월",
        "Backend 임동현 (고급) 10개월",
        "Frontend 강서연 (중급) 10개월",
        "DBA 오현우 (고급) 8개월",
        "QA 한미영 (중급) 6개월",
        "합계: 8명 / 78MM"
      ],
      "speaker_notes": "총 8명, 78MM의 인력이 투입됩니다."
    },
    {
      "index": 12,
      "title": "마스터 일정",
      "purpose": "timeline",
      "key_points": [
        "착수 (1월): 킥오프, 환경구축, 표준정의 (4주)",
        "분석 (2-3월): 요구사항 확정, 현행 분석 (8주)",
        "설계 (4-5월): 아키텍처/화면/DB 설계 (8주)",
        "개발 (6-9월): 코딩, 단위테스트 (16주)",
        "테스트 (10-11월): 통합/성능/인수 테스트 (6주)",
        "이행 (11-12월): 오픈, 운영이관, 안정화 (6주)"
      ],
      "speaker_notes": "총 12개월, 6단계로 프로젝트를 수행합니다."
    },
    {
      "index": 13,
      "title": "주요 마일스톤",
      "purpose": "process",
      "key_points": [
        "M1 착수보고 (1/10): 수행계획서",
        "M2 요구사항 확정 (3/31): 요구사항정의서",
        "M3 설계 완료 (5/31): 설계서 일체",
        "M4 개발 완료 (9/30): 소스코드",
        "M5 테스트 완료 (11/15): 테스트결과서",
        "M6 시스템 오픈 (12/1): 오픈보고서"
      ],
      "speaker_notes": "6개 마일스톤으로 진척을 관리합니다."
    },
    {
      "index": 14,
      "title": "품질 및 위험 관리",
      "purpose": "section",
      "key_points": ["04"],
      "speaker_notes": "품질 보증 활동과 위험 관리 계획을 설명합니다."
    },
    {
      "index": 15,
      "title": "품질 및 보안 관리",
      "purpose": "comparison",
      "key_points": [
        "품질 보증: 산출물 검토, 코드 리뷰 (GitHub PR 2인 승인), 정적 분석 (SonarQube)",
        "인적 보안: 보안서약서, 보안 교육",
        "물리 보안: 통제구역 출입, 반입 장비 통제",
        "기술 보안: 소스코드 보안약점 진단 (OWASP Top 10), DB 암호화, DLP 적용"
      ],
      "speaker_notes": "품질 게이트와 보안 정책을 통해 프로젝트 품질을 보증합니다."
    },
    {
      "index": 16,
      "title": "위험 및 변경 관리",
      "purpose": "grid",
      "key_points": [
        "요구사항 변경 (상/상): CCB 통제, 영향도 분석 필수",
        "일정 지연 (상/중): 주간 진척관리, Critical Path 모니터링",
        "기술적 난제 (중/중): PoC 선행, 외부 전문가 자문",
        "데이터 마이그레이션 (상/중): 사전 검증, 롤백 계획 수립"
      ],
      "speaker_notes": "변경 요청은 Jira 등록 → 영향도 분석 (3일 내) → CCB 승인 (주 1회) 절차를 따릅니다."
    },
    {
      "index": 17,
      "title": "감사합니다",
      "purpose": "closing",
      "key_points": [
        "(주)테크솔루션",
        "PM 김철수",
        "T. 02-1234-5678",
        "E. pm@techsolution.co.kr"
      ],
      "speaker_notes": "질의응답 시간입니다."
    }
  ]
}
