{
  "session": {
    "id": "2026-01-09_134636_project-plan",
    "title": "스마트 물류관리 시스템 구축 프로젝트 수행계획서",
    "status": "in_progress",
    "created_at": "2026-01-09T13:46:36+09:00",
    "updated_at": "2026-01-09T13:48:00+09:00"
  },
  "current_stage": 3,
  "setup": {
    "presentation": {
      "title": "스마트 물류관리 시스템 구축 프로젝트 수행계획서",
      "subtitle": "착수보고",
      "audience": "혼합 (경영진+실무자)",
      "duration": "20-30분",
      "slide_count_target": "15-20장",
      "source_file": "project-plan.md"
    },
    "theme": {
      "id": "deepgreen",
      "name": "Deep Green",
      "colors": {
        "primary": "#1E5128",
        "secondary": "#4E9F3D",
        "accent": "#D8E9A8",
        "background": "#FFFFFF",
        "surface": "#F4F6F6",
        "dark_text": "#191A19",
        "light": "#FFFFFF",
        "gray": "#AAB7B8"
      }
    }
  },
  "slides": [
    {
      "index": 0,
      "title": "스마트 물류관리 시스템 구축",
      "purpose": "cover",
      "key_points": ["프로젝트 수행계획서", "(주)테크솔루션", "2025-01-06"],
      "speaker_notes": "착수보고 프레젠테이션 표지",
      "template_id": "deepgreen-cover-centered1",
      "match_score": 0.95,
      "match_reason": "category: cover 정확 매칭"
    },
    {
      "index": 1,
      "title": "목차",
      "purpose": "toc",
      "key_points": ["프로젝트 개요", "추진 전략 및 방법론", "프로젝트 조직", "프로젝트 일정", "품질 및 위험 관리"],
      "speaker_notes": "발표 목차 안내",
      "template_id": "deepgreen-toc-3col1",
      "match_score": 0.90,
      "match_reason": "category: toc, 5개 섹션을 3열로 표현"
    },
    {
      "index": 2,
      "title": "01. 프로젝트 개요",
      "purpose": "section",
      "key_points": ["섹션 구분"],
      "speaker_notes": "첫 번째 섹션 시작",
      "template_id": "deepgreen-section-number1",
      "match_score": 0.95,
      "match_reason": "category: section, VERSION 번호 스타일"
    },
    {
      "index": 3,
      "title": "프로젝트 배경 및 목적",
      "purpose": "content",
      "key_points": ["발주기관: (주)글로벌물류", "수행사: (주)테크솔루션", "계약금액: 15억원", "계약기간: 2025.01.06 ~ 2025.12.31", "현황: 10년 이상 운영 레거시 시스템 노후화", "목표: AI 기반 물류 최적화, 실시간 추적"],
      "speaker_notes": "프로젝트 기본 정보와 배경 설명",
      "template_id": "basic-content-2col0",
      "match_score": 0.85,
      "match_reason": "2열 텍스트 콘텐츠 배치에 적합"
    },
    {
      "index": 4,
      "title": "기대 효과",
      "purpose": "stats",
      "key_points": ["물류 처리 효율 30% 향상", "재고 정확도 99.5% 달성", "운영 비용 20% 절감"],
      "speaker_notes": "3가지 핵심 기대효과 수치 강조",
      "template_id": "basic-stats-cards",
      "match_score": 0.92,
      "match_reason": "3-4개 카드 (그리드 배치), KPI 대시보드"
    },
    {
      "index": 5,
      "title": "프로젝트 범위",
      "purpose": "table",
      "key_points": ["WMS: 창고관리시스템", "TMS: 배송관리시스템", "OMS: 주문관리시스템", "Dashboard: 통합모니터링"],
      "speaker_notes": "4개 핵심 시스템 모듈 범위 설명",
      "template_id": "basic-table-simple3",
      "match_score": 0.88,
      "match_reason": "데이터 비교, 스펙 비교용 테이블"
    },
    {
      "index": 6,
      "title": "02. 추진 전략 및 방법론",
      "purpose": "section",
      "key_points": ["섹션 구분"],
      "speaker_notes": "두 번째 섹션 시작",
      "template_id": "deepgreen-section-number1",
      "match_score": 0.95,
      "match_reason": "category: section"
    },
    {
      "index": 7,
      "title": "핵심 추진 전략",
      "purpose": "feature",
      "key_points": ["단계적 전환 전략", "애자일 기반 개발", "현업 밀착 협업"],
      "speaker_notes": "3가지 핵심 전략 설명",
      "template_id": "deepgreen-grid-3col1",
      "match_score": 0.90,
      "match_reason": "3열 그리드 레이아웃, 콘텐츠 카드"
    },
    {
      "index": 8,
      "title": "기술 아키텍처",
      "purpose": "table",
      "key_points": ["Frontend: Vue.js 3", "Backend: Spring Boot", "Database: PostgreSQL, Redis", "Infra: AWS", "AI/ML: Python, TensorFlow"],
      "speaker_notes": "기술 스택 구성 설명",
      "template_id": "basic-table-simple4",
      "match_score": 0.88,
      "match_reason": "기술 스택 테이블 표현"
    },
    {
      "index": 9,
      "title": "03. 프로젝트 조직",
      "purpose": "section",
      "key_points": ["섹션 구분"],
      "speaker_notes": "세 번째 섹션 시작",
      "template_id": "deepgreen-section-number1",
      "match_score": 0.95,
      "match_reason": "category: section"
    },
    {
      "index": 10,
      "title": "조직 및 역할",
      "purpose": "hierarchy",
      "key_points": ["발주기관 PM: 정민호 부장", "수행사 PM: 김철수 차장", "AA: 박준형 책임", "개발 리더: 최수진 선임", "투입 인력: 8명, 78MM"],
      "speaker_notes": "프로젝트 조직 구성 및 R&R",
      "template_id": "basic-hierarchy-org-40",
      "match_score": 0.90,
      "match_reason": "조직 구조도 표시, 계층 관계 표현"
    },
    {
      "index": 11,
      "title": "04. 프로젝트 일정",
      "purpose": "section",
      "key_points": ["섹션 구분"],
      "speaker_notes": "네 번째 섹션 시작",
      "template_id": "deepgreen-section-number1",
      "match_score": 0.95,
      "match_reason": "category: section"
    },
    {
      "index": 12,
      "title": "마스터 일정 및 마일스톤",
      "purpose": "timeline",
      "key_points": ["착수: 2025.01", "분석: 2025.02-03", "설계: 2025.04-05", "개발: 2025.06-09", "테스트: 2025.10-11", "이행: 2025.11-12"],
      "speaker_notes": "6단계 마스터 일정 및 주요 마일스톤",
      "template_id": "basic-process-6step1",
      "match_score": 0.92,
      "match_reason": "6개 단계 표현, 상세 복합 프로세스"
    },
    {
      "index": 13,
      "title": "05. 품질 및 위험 관리",
      "purpose": "section",
      "key_points": ["섹션 구분"],
      "speaker_notes": "다섯 번째 섹션 시작",
      "template_id": "deepgreen-section-number1",
      "match_score": 0.95,
      "match_reason": "category: section"
    },
    {
      "index": 14,
      "title": "품질/보안/위험 관리",
      "purpose": "grid",
      "key_points": ["품질: 산출물 검토, 코드 리뷰, 정적 분석", "보안: 보안서약서, 출입 관리, OWASP 점검", "위험: CCB 통제, Critical Path 모니터링"],
      "speaker_notes": "품질, 보안, 위험 관리 계획",
      "template_id": "deepgreen-grid-3col1",
      "match_score": 0.90,
      "match_reason": "3열 그리드 레이아웃"
    },
    {
      "index": 15,
      "title": "감사합니다",
      "purpose": "closing",
      "key_points": ["Q&A", "연락처: PM 김철수"],
      "speaker_notes": "마무리 및 Q&A 안내",
      "template_id": "deepgreen-closing1",
      "match_score": 0.95,
      "match_reason": "category: closing"
    }
  ]
}
