{
  "session": {
    "id": "2026-01-09_prd-explanation",
    "title": "PPT Skills Suite PRD v4.9 팀 설명",
    "created_at": "2026-01-09T00:00:00Z",
    "status": "completed"
  },
  "current_stage": 2,
  "setup": {
    "presentation": {
      "title": "PPT Skills Suite",
      "subtitle": "PRD v4.9 팀 설명",
      "audience": "개발팀, 기획팀",
      "purpose": "서비스 아키텍처 및 기능 설명"
    },
    "theme": {
      "id": "dongkuk-systems",
      "name": "동국시스템즈",
      "colors": {
        "primary": "#002452",
        "secondary": "#C51F2A",
        "accent": "#4B6580",
        "background": "#FFFFFF",
        "surface": "#F8FAFC",
        "dark_text": "#262626",
        "light": "#FFFFFF",
        "gray": "#B6B6B6"
      },
      "fonts": {
        "title": "본고딕 Medium",
        "body": "본고딕 Normal"
      }
    },
    "source": "PRD_PPT_Skills_Suite.md",
    "document_template": "dongkuk-systems/기본양식"
  },
  "slides": [
    {
      "index": 0,
      "title": "표지",
      "purpose": "cover",
      "key_points": ["PPT Skills Suite", "PRD v4.9", "팀 설명"],
      "layout_index": 1
    },
    {
      "index": 1,
      "title": "목차",
      "purpose": "toc",
      "key_points": ["개요", "아키텍처", "ppt-extract", "ppt-gen", "템플릿 시스템"],
      "layout_index": 2
    },
    {
      "index": 2,
      "title": "1. 개요",
      "purpose": "section",
      "key_points": ["제품 비전", "핵심 결정사항"],
      "layout_index": 2
    },
    {
      "index": 3,
      "title": "제품 비전",
      "purpose": "content",
      "key_points": ["전문 디자이너 수준 PPT", "2개 스킬 + 1 앱", "자동 생성"],
      "layout_index": 3
    },
    {
      "index": 4,
      "title": "타겟 사용자",
      "purpose": "content",
      "key_points": ["기업/비즈니스 사용자", "컨설턴트/스타트업", "디자이너"],
      "layout_index": 3
    },
    {
      "index": 5,
      "title": "2. 아키텍처",
      "purpose": "section",
      "key_points": ["시스템 구조"],
      "layout_index": 2
    },
    {
      "index": 6,
      "title": "2개 스킬 + 1 앱 구조",
      "purpose": "content",
      "key_points": ["ppt-extract (추출)", "ppt-gen (생성)", "ppt-manager (관리)"],
      "layout_index": 3
    },
    {
      "index": 7,
      "title": "3. ppt-extract 스킬",
      "purpose": "section",
      "key_points": ["템플릿/에셋 추출"],
      "layout_index": 2
    },
    {
      "index": 8,
      "title": "ppt-extract 워크플로우",
      "purpose": "content",
      "key_points": ["content-extract", "document-extract", "style-extract"],
      "layout_index": 3
    },
    {
      "index": 9,
      "title": "4. ppt-gen 스킬",
      "purpose": "section",
      "key_points": ["PPT 생성"],
      "layout_index": 2
    },
    {
      "index": 10,
      "title": "ppt-gen 워크플로우",
      "purpose": "content",
      "key_points": ["html2pptx", "template", "ooxml"],
      "layout_index": 3
    },
    {
      "index": 11,
      "title": "5단계 생성 파이프라인",
      "purpose": "content",
      "key_points": ["Setup", "Outline", "Matching", "Content", "Generation"],
      "layout_index": 3
    },
    {
      "index": 12,
      "title": "5. 템플릿 시스템",
      "purpose": "section",
      "key_points": ["v4.0 템플릿 구조"],
      "layout_index": 2
    },
    {
      "index": 13,
      "title": "템플릿 시스템 v4.0",
      "purpose": "content",
      "key_points": ["themes", "contents", "documents", "assets"],
      "layout_index": 3
    },
    {
      "index": 14,
      "title": "마무리",
      "purpose": "closing",
      "key_points": ["Thank You", "Q&A"],
      "layout_index": 1
    }
  ],
  "output": {
    "pptx_file": "PPT_Skills_Suite_PRD_v4.9.pptx",
    "slide_count": 15
  }
}
